{
	"name": "env-specific-bss",
	"version": 23.1,
	"parameters": {
		"OVERRIDE_PARAMETER": "env-specific-value"
	},
	"applications": [
		{
			"appName": "PROJECT-NOTIFICATION",
			"parameters": {
				"CPQ_QUOTE_NOTIFICATION_TOPIC": "DV.Customer.QuoteManagement.Quote",
        		"PROJECT_IBS_NOTIFICATION_SERVICE_TOPIC" : "DV.Product.ProductInventory.Product",
        		"OM_PROJECT_ORDER_NOTIFICATION_TOPIC" : "DV.Customer.ProductOrdering.ProductOrder"
			}	
		}
	]
}
