{
  "name" : "common",
  "version" : 23.1,
  "parameters" : {
    "GATEWAYS_ALLOWED_ORIGIN" : "*.qubership.org,*.qubership.org:*,*.qubership.cloud:*,*.prj.nu:*,*.np-nuuazure.dk,*.np-nuuazure.dk:*",
    "CONSUL_ENABLED" : "true",
    "GLOBAL_RESOURCE_PROFILE" : "'{\n    \"ftpd_dev\": {\n        \"cloud-integration-platform-systems-catalog\": {\n          \"#inherit\": \"dev_az11\",\n          \"_comment\": \"For egress-gateway-gateway.\",\n          \"EGRESS_GATEWAY_MEMORY\": \"128Mi\"\n        },\n        \"content-delivery-manager\": {\n          \"#inherit\": \"dev_az11\",\n          \"CPU_REQUEST\": \"50m\",\n          \"MEMORY_REQUEST\": \"75Mi\",\n          \"CPU_LIMIT\": \"1\",\n          \"MEMORY_LIMIT\": \"75Mi\"\n        },\n        \"nifi-config-service\": {\n          \"#inherit\": \"dev_az11\",\n          \"CPU_REQUEST\": \"100m\",\n          \"MEMORY_REQUEST\": \"140Mi\",\n          \"CPU_LIMIT\": \"1000m\",\n          \"MEMORY_LIMIT\": \"356Mi\"\n        },\n        \"cpm-core-service\": {\n          \"#inherit\": \"dev\",\n          \"_comment\": \"For project-cpm-gateway.\",\n          \"COMPOSITE_GATEWAY_CPU_REQUEST\": \"100m\",\n          \"COMPOSITE_GATEWAY_MEMORY_REQUEST\": \"35Mi\",\n          \"COMPOSITE_GATEWAY_MEMORY_LIMIT\": \"128Mi\"\n        },\n        \"bss-configuration-service\": {\n          \"#inherit\": \"dev_az11\",\n          \"_comment\": \"For bsscs-composite-gateway.\",\n          \"COMPOSITE_GATEWAY_MEMORY_REQUEST\": \"100Mi\",\n          \"COMPOSITE_GATEWAY_MEMORY_LIMIT\": \"100Mi\"\n        },\n        \"geo-site-core\": {\n          \"#inherit\": \"dev_az11\",\n          \"_comment\": \"For geo-site-core-composite-gateway.\",\n          \"COMPOSITE_GATEWAY_MEMORY_REQUEST\": \"124Mi\",\n          \"COMPOSITE_GATEWAY_MEMORY_LIMIT\": \"124Mi\"\n        },\n        \"cdc-nifi-integrations\": {\n          \"#inherit\": \"dev_az11\",\n          \"CPU_REQUEST\": \"100m\",\n          \"MEMORY_REQUEST\": \"200Mi\",\n          \"CPU_LIMIT\": \"1000m\",\n          \"MEMORY_LIMIT\": \"200Mi\"\n        },\n        \"tenant-manager\": {\n          \"#inherit\": \"dev_az11\",\n          \"CPU_REQUEST\": \"30m\",\n          \"MEMORY_REQUEST\": \"500Mi\",\n          \"CPU_LIMIT\": \"1500m\",\n          \"MEMORY_LIMIT\": \"500Mi\"\n        },\n        \"dumps-cleanup-service\": {\n          \"#inherit\": \"dev_az11\",\n          \"DUMPS_CLEANUP_SERVICE_CPU_REQUEST\": \"20m\",\n          \"DUMPS_CLEANUP_SERVICE_MEMORY_REQUEST\": \"100Mi\",\n          \"DUMPS_CLEANUP_SERVICE_CPU_LIMIT\": \"100m\",\n          \"DUMPS_CLEANUP_SERVICE_MEMORY_LIMIT\": \"150Mi\"\n        },\n        \"frontend-gateway\": {\n          \"#inherit\": \"dev_az11\",\n          \"INTERNAL_GW_MEMORY_LIMIT\": \"200Mi\",\n          \"INTERNAL_GW_MEMORY_REQUEST\": \"200Mi\",\n          \"INTERNAL_GW_CPU_LIMIT\": \"500m\",\n          \"PRIVATE_GW_MEMORY_LIMIT\": \"100Mi\",\n          \"PRIVATE_GW_MEMORY_REQUEST\": \"100Mi\",\n          \"PRIVATE_GW_CPU_LIMIT\": \"100m\",\n          \"CPU_REQUEST\": \"30m\"\n        },\n        \"bss-cloud-portal-proxy\": {\n          \"#inherit\": \"dev_az11\",\n          \"MEMORY_LIMIT\": \"48Mi\"\n        },\n        \"bss-config-manager-frontend\": {\n          \"#inherit\": \"dev_az11\",\n          \"MEMORY_LIMIT\": \"48Mi\",\n          \"MEMORY_REQUEST\": \"48Mi\"\n        },\n        \"project-workplaces-configuration\": {\n          \"#inherit\": \"dev_az11\",\n          \"MEMORY_LIMIT\": \"48Mi\"\n        },\n        \"nifi-config-proxy-service\": {\n          \"#inherit\": \"dev\",\n          \"MEMORY_REQUEST\": \"48Mi\"\n        },\n        \"pim-frontend-srv\": {\n          \"#inherit\": \"dev_az11\",\n          \"MEMORY_LIMIT\": \"48Mi\",\n          \"MEMORY_REQUEST\": \"48Mi\"\n        },\n        \"uim\": {\n          \"#inherit\": \"dev\",\n          \"COMPOSITE_GATEWAY_MEMORY_LIMIT\": \"96Mi\",\n          \"CPU_REQUEST\": \"200m\",\n          \"MEMORY_REQUEST\": \"1254Mi\",\n          \"CPU_LIMIT\": \"1\",\n          \"MEMORY_LIMIT\": \"1254Mi\",\n\t\t  \"PREDEPLOY_MEMORY_LIMIT\" : \"1024Mi\",\n          \"PREDEPLOY_MEMORY_REQUEST\" : \"1024Mi\"\n        },\n        \"access-control\": {\n          \"#inherit\": \"dev\",\n          \"MEMORY_REQUEST\": \"550Mi\",\n          \"MEMORY_LIMIT\": \"550Mi\"\n        },\n        \"facade-operator\": {\n          \"#inherit\": \"dev\",\n          \"_comment\": \"This memory limit only applies to those gateways whose service does not have an explicitly defined FacadeService. If the service has an explicitly defined FacadeService, then the parameter COMPOSITE_GATEWAY_MEMORY_LIMIT must be passed to this service.\",\n          \"FACADE_GATEWAY_MEMORY_LIMIT\": \"96Mi\"\n        }\n      }\n}'",
    "NC_DIAGNOSTIC_MODE" : "prod"
  },
  "applications" : [ {
    "parameters" : {
      "ACCESS_CONTROL_REMOTE_SETTINGS_ENABLED" : "true",
      "ACCESS_CONTROL_ADMIN_ROLE" : "ROLE_Security_Admin",
      "TEST_PARAM": "test_value"
    },
    "appName" : "Access-Control"
  }, {
    "parameters" : {
      "GW_INGRESS_ANNOTATIONS" : "nginx.ingress.kubernetes.io/proxy-body-size: '400m'\nnginx.ingress.kubernetes.io/proxy-connect-timeout: '2000'\nnginx.ingress.kubernetes.io/proxy-read-timeout: '2000'\nnginx.ingress.kubernetes.io/proxy-send-timeout: '2000'",
      "DBAAS_AGENT_NAMESPACE_ISOLATION_ENABLED" : "false",
      "DEFAULT_TENANT_NAME" : "${tenant.cloud.DEFAULT_TENANT_NAME}",
      "TENANT_LEVEL_ROLES" : "PRODUCT-MANAGER TENANT-ADMIN CUSTOMER-SALES-REPRESENTATIVE CONTENT-MANAGER CUSTOMER-SUPPORT-AGENT GLOBAL-CUSTOMER-SALES-REPRESENTATIVE PORTFOLIO-MANAGER ROLE_READ-ONLY-USER ROLE_CAMPAIGN-AGENT ROLE_CAMPAIGN-MANAGER ROLE_CONTACT-POLICY-MANAGER ROLE_ADMINISTRATOR ROLE_CJM-USER ROLE_CJM-ADMINISTRATOR ROLE_CJM-READ-ONLY-USER ROLE_Security_Admin ROLE_Customer ROLE_CSR ROLE_Salesint_Prod_Admin ROLE_GRAPHQL_USER ROLE_BIS_RO ROLE_BIS_RW ROLE_Cpq_Admin ROLE_Cpq_Product_Sales_Partner ROLE_Cpq_Product_Pre_Sales ROLE_Cpq_Product_Sales_Manager ROLE_Cpq_Product_Director ROLE_Cpq_Product_VP ROLE_Cpq_Product_Commercial_Director ROLE_Cpq_Product_CEO_CFO ROLE_Cpq_Product_Reporting ROLE_Cpq_Product_Anonymous_Customer ROLE_UTM_EXECUTOR ROLE_UTM_SUPERVISOR ROLE_UTM_ADMINISTRATOR ROLE_ORGCHART_ADMINISTRATOR ROLE_ORGCHART_MANAGER ROLE_ORGCHART_TEAM_LEAD ROLE_BC_ADMINISTRATOR ROLE_PIM-ADMIN AM-ADMIN AM-STOCK-USER ROLE_UIM-USER ROLE_cloud-om-ui-read-all ROLE_cloud-om-ui-write-all ROLE_cloud-om-catalog-read-all ROLE_cloud-om-catalog-write-all ROLE_cloud-om-read-product-order ROLE_cloud-om-submit-product-order ROLE_cloud-om-read-service-order ROLE_cloud-om-submit-service-order ROLE_cloud-om-update-order ROLE_cloud-om-read-product-offering-qualification ROLE_cloud-om-submit-product-offering-qualification ROLE_DS_SuperUser ROLE_DS_Sales_Agent ROLE_DS_Sales_Manager ROLE_DS_Administrator ROLE_RTD-READ-ONLY-USER ROLE_RTD-ADMINISTRATOR ROLE_RTC-D-EXT-CLIENT ROLE_CPM_Admin ROLE_cdc_control_superuser ROLE_cdc_control_viewer ROLE_cdc_test_db_superuser ROLE_cdc_control_executor ROLE_cdc_control_importer ROLE_CIP_ADMIN ROLE_BSSCM-ADMIN ROLE_CLOUD-HDS-ADMIN ROLE_CLOUD-HDS-USER ROLE_DPC_USER ROLE_DPC_CONFIGURATOR ROLE_DPC_ADMIN ROLE_RCW-ADMIN ROLE_SCT-ADMIN ROLE_billing-eca-api-access ROLE_CIP_DEV ROLE_CIP_CUSTOMER ROLE_CLOUD-ADMIN ROLE_ID_INTERACTIONS_READ_ONLY_USER ROLE_ID_INTERACTIONS_USER ROLE_ID_DOCUMENTS_READ_ONLY_USER ROLE_ID_DOCUMENTS_USER ROLE_ID_ADMINISTRATOR ROLE_ID_READ_ONLY_USER ROLE_ID_USER ROLE_CDN-ADMIN ROLE_DST-ADMIN ROLE_DST-EXPORT-USER ROLE_DST-EXPORT-ADMIN ROLE_DST-IMPORT-USER ROLE_DFT_USER ROLE_DFT_VIEW ROLE_DFT_ADMIN ROLE_GMS_MOBILE_APP_USER ROLE_DPT_USER ROLE_DPT_ADMIN ROLE_ea_user"
    },
    "appName" : "Cloud-Core"
  }, {
    "parameters" : {
      "KAFKA_CLUSTER_URL" : "${KAFKA_BOOTSTRAP_SERVER}"
    },
    "appName" : "Cloud-Frontend-Platform"
  }, {
    "parameters" : {
      "DICTIONARIES_SECURITY_ROLES" : "ROLE_metamodel-provider-backend,ROLE_metamodel-sample,ROLE_cim-core-service,ROLE_party-interaction-core-service,ROLE_account-mgmt-core,ROLE_payment-method-mgmt-core,ROLE_csrd-fragment-cim-api,ROLE_cpm-core-service,ROLE_external_Cpq_Product_Anonymous_Customer,ROLE_Cpq_Product_Anonymous_Customer,ROLE_TENANT-ADMIN,ROLE_M2M,ROLE_Customer,ROLE_CSR,ROLE_DS_Sales_Agent,ROLE_DS_Sales_Manager,ROLE_DS_SuperUser"
    },
    "appName" : "Core-Extensions"
  }, {
    "parameters" : {
      "ESC_COLLECTOR_PORT" : "1715",
      "ESC_STATIC_HOST" : "${tenant.cloud.CLOUD_ESC_STATIC_HOST}",
      "ESC_COLLECTOR_NS" : "${tenant.cloud.CLOUD_ESC_COLLECTOR_NS}",
      "ESC_STATIC_PORT" : "8080",
      "JAEGER_COLLECTOR_HOST" : "${tenant.cloud.CLOUD_JAEGER_COLLECTOR_HOST}",
      "ZIPKIN_COLLECTOR_HOST" : "${tenant.cloud.CLOUD_JAEGER_COLLECTOR_HOST}",
      "ESC_COLLECTOR_HOST" : "${tenant.cloud.CLOUD_ESC_COLLECTOR_HOST}"
    },
    "appName" : "qs-diagnostic-agent"
  } ]
}
